{
  "concept_id": "intent.endorser_must_discontinue_or_modify_advertisement_2",
  "concept_type": "intent",
  "title": "Questions about Endorser must discontinue or modify advertisement",
  "description": "Natural language queries a user may ask about: Endorser must discontinue or modify advertisement",
  "content": {
    "queries": [
      "What must an endorser do if their advertisement is found to be misleading?",
      "Can an endorser be required to discontinue a misleading endorsement?",
      "What are the obligations of an endorser of a misleading advertisement?"
    ]
  },
  "derived_from": [
    "CPA2019-CH3-S21-1",
    "obligation.endorser_must_discontinue_or_modify_advertisement_as_directe"
  ],
  "related_concepts": [
    "obligation.endorser_must_discontinue_or_modify_advertisement_as_directe"
  ],
  "search": {
    "keywords": [
      "questions",
      "about",
      "endorser",
      "discontinue",
      "modify",
      "advertisement",
      "natural",
      "language",
      "queries",
      "user"
    ],
    "aliases": [
      "advertiser duties",
      "publisher responsibilities"
    ],
    "user_queries": [
      "What must an endorser do if their advertisement is found to be misleading?",
      "Can an endorser be required to discontinue a misleading endorsement?",
      "What are the obligations of an endorser of a misleading advertisement?"
    ]
  },
  "metadata": {
    "jurisdiction": "India",
    "act": "Consumer Protection Act, 2019",
    "language": "en",
    "review_status": "draft",
    "confidence": 0.0,
    "created_by": "IntentAgent",
    "reviewed_by": null,
    "version": 1
  }
}