{
  "concept_id": "obligation.national_commission_shall_lay_down_adequate_standards",
  "concept_type": "obligation",
  "title": "National Commission must lay down standards",
  "description": "The National Commission has the authority to lay down adequate standards for better protection of consumer interests",
  "content": {
    "who": "National Commission",
    "what": "shall lay down adequate standards",
    "conditions": [
      "in consultation with the Central Government",
      "from time to time"
    ],
    "limitations": [
      "Not specified in the Act"
    ]
  },
  "derived_from": [
    "CPA2019-CH4-S70-1"
  ],
  "related_concepts": [
    "authority.central_government",
    "authority.district_commission",
    "procedure.investigation_into_allegations_against_state_commission_memb",
    "procedure.issuance_of_instructions_for_uniform_procedure",
    "procedure.monitoring_performance_of_state_commissions",
    "authority.national_commission",
    "obligation.national_commission_shall_investigate_into_any_allegations_a"
  ],
  "search": {
    "keywords": [
      "National Commission",
      "standards",
      "consumer protection",
      "national",
      "commission",
      "lay",
      "down",
      "has",
      "authority",
      "adequate",
      "better",
      "protection"
    ],
    "aliases": [
      "consumer interests",
      "regulatory authority"
    ],
    "user_queries": [
      "What are the National Commission's responsibilities?",
      "What is national commission must lay down standards?",
      "How does national commission must lay down standards work?",
      "Can you explain national commission must lay down standards?"
    ]
  },
  "metadata": {
    "jurisdiction": "India",
    "act": "Consumer Protection Act, 2019",
    "language": "en",
    "review_status": "reviewed",
    "confidence": 0.75,
    "created_by": "ObligationAgent",
    "reviewed_by": "deep-review-2026-08-03 (complete tier-b review)",
    "version": 1
  }
}
