{
  "concept_id": "procedure.authentication_of_goods",
  "concept_type": "procedure",
  "title": "Authentication of goods",
  "description": "authentication of goods sampled",
  "content": {
    "steps": [
      {
        "order": 1,
        "step": "authentication of goods"
      }
    ],
    "authority": "National Commission",
    "documents": [
      "Not specified in the Act"
    ]
  },
  "derived_from": [
    "CPA2019-CH8-S101-2"
  ],
  "related_concepts": [
    "exception.save_as_otherwise_expressly_provided_under_this_act_or_by_an",
    "procedure.appeal_to_state_commission",
    "procedure.deposit_of_amount",
    "procedure.filing_complaint",
    "procedure.furnishing_information",
    "obligation.government_must_make_rules"
  ],
  "search": {
    "keywords": [
      "authentication",
      "goods",
      "sampled",
      "order",
      "step",
      "national",
      "commission"
    ],
    "aliases": [
      "appeal to national commission",
      "appeal to national consumer commission",
      "national appeal",
      "national commission",
      "national commission appeal",
      "authenticating goods",
      "goods authentication",
      "goods verification"
    ],
    "user_queries": [
      "How do I file appeal to national commission?",
      "What are the steps for appeal to national commission?"
    ]
  },
  "metadata": {
    "jurisdiction": "India",
    "act": "Consumer Protection Act, 2019",
    "language": "en",
    "review_status": "reviewed",
    "confidence": 0.8,
    "created_by": "ProcedureAgent",
    "reviewed_by": "v2-review-llm-70b-2026-08-02",
    "version": 1
  }
}