{
  "concept_id": "intent.empanelment_of_mediators",
  "concept_type": "intent",
  "title": "Questions about Empanelment of mediators",
  "description": "Natural language queries a user may ask about: Empanelment of mediators",
  "content": {
    "queries": [
      "How do I file empanelment of mediators?",
      "What are the steps for empanelment of mediators?"
    ]
  },
  "derived_from": [
    "CPA2019-CH8-S103-2",
    "procedure.empanelment_of_mediators"
  ],
  "related_concepts": [
    "procedure.empanelment_of_mediators"
  ],
  "search": {
    "keywords": [],
    "aliases": [],
    "user_queries": []
  },
  "metadata": {
    "jurisdiction": "India",
    "act": "Consumer Protection Act, 2019",
    "language": "en",
    "review_status": "draft",
    "confidence": 0.0,
    "created_by": "IntentAgent",
    "reviewed_by": null,
    "version": 1
  }
}