{
  "concept_id": "intent.review_of_consumer_rights",
  "concept_type": "intent",
  "title": "Questions about Review of Consumer Rights",
  "description": "Natural language queries a user may ask about: Review of Consumer Rights",
  "content": {
    "queries": [
      "How often are consumer rights reviewed under the Consumer Protection Act?",
      "What is the process for reviewing consumer rights and ensuring they are up-to-date?",
      "Can a consumer request a review of their rights if they feel they have been violated?",
      "How does the review of consumer rights impact the development of new consumer protection policies?",
      "Are there any specific criteria used to determine when a review of consumer rights is necessary?"
    ]
  },
  "derived_from": [
    "CPA2019-CH3-S18-2",
    "procedure.review_of_consumer_rights",
    "alias.review_of_consumer_rights"
  ],
  "related_concepts": [
    "alias.review_of_consumer_rights"
  ],
  "search": {
    "keywords": [
      "questions",
      "about",
      "review",
      "consumer",
      "rights",
      "natural",
      "language",
      "queries",
      "user",
      "ask"
    ],
    "aliases": [
      "advice on consumer welfare",
      "advising on consumer welfare",
      "consumer rights guidance",
      "consumer welfare advice",
      "consumer welfare measures"
    ],
    "user_queries": [
      "What is review of consumer rights?",
      "How does review of consumer rights work?",
      "Can you explain review of consumer rights?"
    ]
  },
  "metadata": {
    "jurisdiction": "India",
    "act": "Consumer Protection Act, 2019",
    "language": "en",
    "review_status": "draft",
    "confidence": 0.0,
    "created_by": "IntentAgent",
    "reviewed_by": null,
    "version": 1
  }
}