{
  "concept_id": "intent.maintenance_of_information_by_consumer_mediation_cell_handled_by_district_commis",
  "concept_type": "intent",
  "title": "Questions about Maintenance of information by consumer mediation cell handled by District Commission",
  "description": "Natural language queries a user may ask about: Maintenance of information by consumer mediation cell handled by District Commission",
  "content": {
    "queries": [
      "What is maintenance of information by consumer mediation cell handled by district commission?",
      "How does maintenance of information by consumer mediation cell handled by district commission work?",
      "Can you explain maintenance of information by consumer mediation cell handled by district commission?"
    ]
  },
  "derived_from": [
    "CPA2019-CH8-S103-2",
    "relationship.procedure_maintenance_of_information_by_consumer_mediation_cell_handle_2"
  ],
  "related_concepts": [
    "relationship.procedure_maintenance_of_information_by_consumer_mediation_cell_handle_2"
  ],
  "search": {
    "keywords": [
      "questions",
      "about",
      "maintenance",
      "information",
      "consumer",
      "mediation",
      "cell",
      "handled",
      "district",
      "commission"
    ],
    "aliases": [
      "adjournment cost",
      "cost imposition by district commission",
      "district commission cost"
    ],
    "user_queries": [
      "What is maintenance of information by consumer mediation cell handled by district commission?",
      "How does maintenance of information by consumer mediation cell handled by district commission work?",
      "Can you explain maintenance of information by consumer mediation cell handled by district commission?"
    ]
  },
  "metadata": {
    "jurisdiction": "India",
    "act": "Consumer Protection Act, 2019",
    "language": "en",
    "review_status": "draft",
    "confidence": 0.0,
    "created_by": "IntentAgent",
    "reviewed_by": null,
    "version": 1
  }
}