{
  "concept_id": "procedure.enforcement_of_order",
  "concept_type": "procedure",
  "title": "Enforcement of Order",
  "description": "Enforcement of order made by District Commission, State Commission or National Commission",
  "content": {
    "steps": [
      {
        "order": 1,
        "step": "Order made by District Commission, State Commission or National Commission"
      },
      {
        "order": 2,
        "step": "Enforcement of order in the same manner as a decree made by a Court in a suit"
      }
    ],
    "authority": "District Commission, State Commission or the National Commission",
    "documents": [
      "Order XXI of the First Schedule to the Code of Civil Procedure, 1908"
    ]
  },
  "derived_from": [
    "CPA2019-CH4-S71"
  ],
  "related_concepts": [
    "authority.court",
    "authority.district_commission",
    "authority.national_commission",
    "authority.state_commission"
  ],
  "search": {
    "keywords": [
      "enforcement",
      "order",
      "made",
      "district",
      "commission",
      "state",
      "national",
      "step",
      "same",
      "manner"
    ],
    "aliases": [
      "Bench",
      "Judiciary",
      "Law Court",
      "Tribunal",
      "judicial body",
      "tribunal",
      "carrying out the judgment",
      "execution of order",
      "implementation of ruling",
      "order enforcement"
    ],
    "user_queries": [
      "What is commission must enforce order?",
      "How does commission must enforce order work?",
      "Can you explain commission must enforce order?"
    ]
  },
  "metadata": {
    "jurisdiction": "India",
    "act": "Consumer Protection Act, 2019",
    "language": "en",
    "review_status": "reviewed",
    "confidence": 1.0,
    "created_by": "ProcedureAgent",
    "reviewed_by": "v2-review-llm-70b-2026-08-02",
    "version": 1
  }
}