{
  "concept_id": "alias.unfair_contract",
  "concept_type": "alias",
  "title": "Unfair Contract",
  "description": "Alternative names and search aliases for: Unfair Contract",
  "content": {
    "aliases": [
      "Abusive Contract",
      "One-Sided Contract",
      "Unconscionable Contract",
      "one-sided contract",
      "unconscionable contract"
    ]
  },
  "derived_from": [
    "CPA2019-CH1-S2-46",
    "definition.unfair_contract"
  ],
  "related_concepts": [
    "obligation.party_to_the_contract_must_accept_early_repayment_of_debts",
    "obligation.party_to_the_contract_must_not_assign_contract_without_consu",
    "obligation.party_to_the_contract_must_not_impose_disproportionate_penal",
    "obligation.party_to_the_contract_must_not_impose_unreasonable_charges_o",
    "obligation.party_to_the_contract_must_not_require_excessive_security_de",
    "obligation.party_to_the_contract_must_not_terminate_contract_unilateral",
    "right.right_to_fair_contract_terms"
  ],
  "search": {
    "keywords": [
      "unfair",
      "contract",
      "alternative",
      "names",
      "search",
      "aliases",
      "abusive",
      "one",
      "sided",
      "unconscionable"
    ],
    "aliases": [
      "Abusive Contract",
      "One-Sided Contract",
      "Unconscionable Contract",
      "one-sided contract",
      "unconscionable contract"
    ],
    "user_queries": [
      "What is unfair contract?",
      "How does unfair contract work?",
      "Can you explain unfair contract?"
    ]
  },
  "metadata": {
    "jurisdiction": "India",
    "act": "Consumer Protection Act, 2019",
    "language": "en",
    "review_status": "draft",
    "confidence": 0.0,
    "created_by": "KeywordAliasAgent",
    "reviewed_by": null,
    "version": 1
  }
}