{
  "concept_id": "relationship.procedure_conduct_of_mediation_handled_by_authority_district_commissio",
  "concept_type": "relationship",
  "title": "Conduct of mediation handled by District Commission",
  "description": "Conduct of mediation --handled_by--> District Commission",
  "content": {
    "source": "procedure.conduct_of_mediation",
    "relationship": "handled_by",
    "target": "authority.district_commission"
  },
  "derived_from": [
    "CPA2019-CH8-S103-2"
  ],
  "related_concepts": [
    "procedure.adjournment_cost_imposition_by_district_commission",
    "procedure.adjournment_cost_imposition_by_state_or_national_commission",
    "obligation.authority_must_provide_for_re_empanelment_of_mediators",
    "obligation.authority_must_set_qualifications_and_experience_for_empanel",
    "procedure.conduct_of_mediation",
    "authority.consumer_mediation_cell",
    "obligation.consumer_mediation_cell_must_maintain_information"
  ],
  "search": {
    "keywords": [
      "conduct",
      "mediation",
      "handled",
      "district",
      "commission",
      "procedure",
      "authority"
    ],
    "aliases": [
      "adjournment cost",
      "cost imposition by district commission",
      "district commission cost"
    ],
    "user_queries": [
      "What is conduct of mediation handled by district commission?",
      "How does conduct of mediation handled by district commission work?",
      "Can you explain conduct of mediation handled by district commission?"
    ]
  },
  "metadata": {
    "jurisdiction": "India",
    "act": "Consumer Protection Act, 2019",
    "language": "en",
    "review_status": "draft",
    "confidence": 0.0,
    "created_by": "RelationshipAgent",
    "reviewed_by": null,
    "version": 1
  }
}