{
  "concept_id": "authority.supreme_court",
  "concept_type": "authority",
  "title": "Supreme Court",
  "description": "Entertains appeals against orders of the National Commission",
  "content": {
    "name": "Supreme Court",
    "role": "Entertains appeals against orders of the National Commission",
    "powers": [
      "Entertaining appeals",
      "Extending time for filing appeals if sufficient cause is shown"
    ],
    "jurisdiction": "whole of India"
  },
  "derived_from": [
    "CPA2019-CH4-S67",
    "CPA2019-CH4-S73-1",
    "CPA2019-CH4-S73-3"
  ],
  "related_concepts": [
    "timeline.thirty_days",
    "procedure.filing_an_appeal_to_the_supreme_court",
    "authority.national_commission",
    "evidence.written_explanation",
    "right.right_to_appeal"
  ],
  "search": {
    "keywords": [
      "supreme",
      "court",
      "entertains",
      "appeals",
      "against",
      "orders",
      "national",
      "commission",
      "entertaining",
      "extending"
    ],
    "aliases": [
      "appeal deadline",
      "filing appeal",
      "opposite party response",
      "time limit for appeal",
      "time limit for application",
      "time to respond",
      "Apex Court",
      "Federal Court",
      "Highest Court",
      "National Court"
    ],
    "user_queries": [
      "What is filing an appeal handled by district commission?",
      "How does filing an appeal handled by district commission work?",
      "Can you explain filing an appeal handled by district commission?"
    ]
  },
  "metadata": {
    "jurisdiction": "India",
    "act": "Consumer Protection Act, 2019",
    "language": "en",
    "review_status": "reviewed",
    "confidence": 0.75,
    "created_by": "AuthorityAgent",
    "reviewed_by": "v2-review-llm-70b-2026-08-02 (bulk, 20% sample agreed)",
    "version": 1
  }
}