{
  "concept_id": "intent.addition_to_other_laws",
  "concept_type": "intent",
  "title": "Questions about Addition to other laws",
  "description": "Natural language queries a user may ask about: Addition to other laws",
  "content": {
    "queries": [
      "What is addition to other laws?",
      "How does addition to other laws work?",
      "Can you explain addition to other laws?"
    ]
  },
  "derived_from": [
    "CPA2019-CH8-S100",
    "exception.shall_not_derogate_from_the_provisions_of_any_other_law_for_"
  ],
  "related_concepts": [
    "exception.shall_not_derogate_from_the_provisions_of_any_other_law_for_"
  ],
  "search": {
    "keywords": [],
    "aliases": [],
    "user_queries": []
  },
  "metadata": {
    "jurisdiction": "India",
    "act": "Consumer Protection Act, 2019",
    "language": "en",
    "review_status": "draft",
    "confidence": 0.0,
    "created_by": "IntentAgent",
    "reviewed_by": null,
    "version": 1
  }
}