{
  "concept_id": "relationship.procedure_complaint_filing_handled_by_authority_central_government",
  "concept_type": "relationship",
  "title": "Complaint filing handled by Central Government",
  "description": "Complaint filing --handled_by--> Central Government",
  "content": {
    "source": "procedure.complaint_filing",
    "relationship": "handled_by",
    "target": "authority.central_government"
  },
  "derived_from": [
    "CPA2019-CH4-S35-1"
  ],
  "related_concepts": [
    "alias.central_authority",
    "alias.central_government",
    "alias.complaint_filing",
    "alias.district_commission",
    "alias.state_government",
    "authority.central_authority",
    "authority.central_government"
  ],
  "search": {
    "keywords": [
      "complaint",
      "filing",
      "handled",
      "central",
      "government",
      "procedure",
      "authority"
    ],
    "aliases": [
      "CCPA",
      "Central Agency",
      "Central Authority",
      "Central Consumer Protection Authority",
      "Central Government Agency",
      "Consumer Protection Agency",
      "Federal Agency",
      "National Authority"
    ],
    "user_queries": [
      "What is complaint filing handled by central government?",
      "How does complaint filing handled by central government work?",
      "Can you explain complaint filing handled by central government?"
    ]
  },
  "metadata": {
    "jurisdiction": "India",
    "act": "Consumer Protection Act, 2019",
    "language": "en",
    "review_status": "draft",
    "confidence": 0.0,
    "created_by": "RelationshipAgent",
    "reviewed_by": null,
    "version": 1
  }
}